Pickled Stormray, Fatali, Ershil, Kashra, Bop, Laesus, Grûnna, Mcsax, Malarky, Birche, Lissy, Bovis, Synapsy, Kharadras, Zinc, Caelastraz, Aphrodítes, Lylk, Nefele, Rikezuge, Tuyna, Rektharthorn, Senll, Kage, Zugzugthorn, Trejwar, Amagaddon, Myazaki, Ridaar, Shagrath, Ariathorn, Paimai, Mtut, Kniv, Chaoslol, Moorder, Trejgoth, Gribbz, Lethean, Abyssinthia, Abyssinthis, Boredsoon, Dikkekont, Aesthesia, Ezeltjeprik, Redcloak, Uglizon, Emfargo, Drfizzy, Fizzx
Spiced Rib Roast, Fatali, Grûnna, Synapsy, Kage, Trejwar, Myazaki, Ridaar, Shagrath, Paimai, Mtut, Boredsoon, Uglizon
Azshari Salad, Fatali, Mcsax, Birche, Lissy, Synapsy, Rikezuge, Zugzugthorn, Trejwar, Myazaki, Kniv, Lethean, Abyssinthia, Uglizon, Emfargo
Nightborne Delicacy Platter, Fatali, Grûnna, Mcsax, Malarky, Birche, Lissy, Kharadras, Caelastraz, Aphrodítes, Kage, Zugzugthorn, Trejwar, Myazaki, Ridaar, Shagrath, Ariathorn, Paimai, Kniv, Lethean, Abyssinthia, Uglizon, Emfargo
Seed-Battered Fish Plate, Fatali, Lissy, Zugzugthorn, Trejwar, Myazaki, Kniv, Lethean
Fighter Chow, Fatali, Ershil, Bop, Laesus, Grûnna, Mcsax, Malarky, Birche, Lissy, Bovis, Synapsy, Zinc, Doublelift, Caelastraz, Aphrodítes, Nefele, Rikezuge, Wâlda, Tuyna, Rektharthorn, Senll, Kage, Zugzugthorn, Trejwar, Brudmar, Amagaddon, Ridaar, Shagrath, Ariathorn, Paimai, Mtut, Kniv, Moorder, Trejgoth, Gribbz, Lethean, Abyssinthia, Sagetotem, Abyssinthis, Boredsoon, Dikkekont, Aesthesia, Xplicite, Ezeltjeprik, Farmpleb, Redcloak, Uglizon, Smoothy, Drfizzy, Revialea
Salt and Pepper Shank, Fatali, Ershil, Grûnna, Mcsax, Lissy, Synapsy, Kharadras, Doublelift, Caelastraz, Aphrodítes, Lylk, Rektharthorn, Kage, Zugzugthorn, Trejwar, Brudmar, Amagaddon, Myazaki, Ridaar, Shagrath, Smóóthy, Paimai, Mtut, Kniv, Trejgoth, Sagetotem, Abyssinthis, Ezeltjeprik, Uglizon, Emfargo, Smoothy, Drfizzy, Fizzx, Revialea
Faronaar Fizz, Fatali, Ershil, Kashra, Bop, Laesus, Grûnna, Mcsax, Malarky, Birche, Lissy, Bovis, Synapsy, Kharadras, Zinc, Doublelift, Caelastraz, Aphrodítes, Nefele, Rikezuge, Wâlda, Tuyna, Rektharthorn, Senll, Kage, Zugzugthorn, Trejwar, Brudmar, Amagaddon, Ridaar, Shagrath, Ariathorn, Paimai, Mtut, Kniv, Chaoslol, Moorder, Trejgoth, Gribbz, Lethean, Abyssinthia, Sagetotem, Abyssinthis, Boredsoon, Dikkekont, Aesthesia, Xplicite, Ezeltjeprik, Farmpleb, Redcloak, Ambiguous, Uglizon, Emfargo, Smoothy, Drfizzy, Revialea
Suramar Surf and Turf, Fatali, Lissy, Rikezuge, Tuyna, Zugzugthorn, Trejwar, Myazaki, Kniv, Lethean, Abyssinthia, Fizzx
Barracuda Mrglgagh, Fatali, Ershil, Grûnna, Mcsax, Lissy, Synapsy, Kharadras, Doublelift, Caelastraz, Aphrodítes, Lylk, Tuyna, Rektharthorn, Kage, Zugzugthorn, Trejwar, Brudmar, Amagaddon, Myazaki, Ridaar, Shagrath, Ariathorn, Smóóthy, Paimai, Mtut, Kniv, Sagetotem, Abyssinthis, Ezeltjeprik, Uglizon, Emfargo, Smoothy, Drfizzy, Revialea
Koi-Scented Stormray, Fatali, Lissy, Trejwar
Drogbar-Style Salmon, Fatali, Ershil, Kashra, Grûnna, Mcsax, Malarky, Lissy, Synapsy, Zinc, Caelastraz, Aphrodítes, Lylk, Nefele, Rikezuge, Tuyna, Kage, Zugzugthorn, Trejwar, Brudmar, Amagaddon, Shagrath, Ariathorn, Paimai, Mtut, Kniv, Chaoslol, Moorder, Trejgoth, Gribbz, Lethean, Abyssinthia, Sagetotem, Aesthesia, Xplicite, Farmpleb, Emfargo, Smoothy, Drfizzy, Fizzx, Revialea
Fishbrul Special, Fatali, Grûnna, Lissy, Synapsy, Aphrodítes, Rikezuge, Tuyna, Kage, Zugzugthorn, Trejwar, Kniv, Abyssinthia
Dried Mackerel Strips, Fatali, Ershil, Kashra, Bop, Laesus, Grûnna, Mcsax, Malarky, Birche, Lissy, Bovis, Synapsy, Kharadras, Zinc, Caelastraz, Aphrodítes, Lylk, Nefele, Rikezuge, Wâlda, Tuyna, Rektharthorn, Senll, Kage, Zugzugthorn, Trejwar, Brudmar, Amagaddon, Myazaki, Ridaar, Shagrath, Ariathorn, Smóóthy, Paimai, Mtut, Kniv, Chaoslol, Moorder, Trejgoth, Gribbz, Lethean, Abyssinthia, Sagetotem, Abyssinthis, Boredsoon, Dikkekont, Aesthesia, Xplicite, Ezeltjeprik, Farmpleb, Redcloak, Ambiguous, Uglizon, Emfargo, Smoothy, Drfizzy, Fizzx, Revialea
Bear Tartare, Fatali, Ershil, Bop, Laesus, Mcsax, Malarky, Birche, Lissy, Synapsy, Caelastraz, Aphrodítes, Lylk, Nefele, Rikezuge, Senll, Kage, Zugzugthorn, Trejwar, Amagaddon, Myazaki, Ridaar, Paimai, Mtut, Kniv, Moorder, Lethean, Abyssinthia, Abyssinthis, Boredsoon, Dikkekont, Xplicite, Ezeltjeprik, Farmpleb, Redcloak, Ambiguous, Emfargo, Drfizzy
Hearty Feast, Fatali, Grûnna, Synapsy, Kage, Trejwar, Ridaar, Shagrath, Paimai, Uglizon
Deep-Fried Mossgill, Fatali, Ershil, Kashra, Grûnna, Mcsax, Malarky, Birche, Lissy, Bovis, Synapsy, Kharadras, Zinc, Doublelift, Caelastraz, Aphrodítes, Lylk, Rikezuge, Wâlda, Tuyna, Kage, Zugzugthorn, Trejwar, Brudmar, Amagaddon, Myazaki, Ridaar, Shagrath, Ariathorn, Paimai, Mtut, Kniv, Chaoslol, Trejgoth, Gribbz, Lethean, Abyssinthia, Sagetotem, Abyssinthis, Boredsoon, Dikkekont, Aesthesia, Redcloak, Ambiguous, Uglizon, Emfargo, Drfizzy, Fizzx, Revialea
Spiced Wildfowl Omelet, Fatali, Kashra, Lissy, Kage, Zugzugthorn, Ridaar, Kniv, Lethean
The Hungry Magister, Grûnna, Mcsax, Lissy, Aphrodítes, Tuyna, Zugzugthorn, Trejwar, Myazaki, Ridaar, Shagrath, Kniv, Lethean, Abyssinthia, Dikkekont, Uglizon, Emfargo
Leybeque Ribs, Grûnna, Mcsax, Lissy, Bovis, Aphrodítes, Tuyna, Trejwar, Myazaki, Ridaar, Kniv, Abyssinthia, Boredsoon, Dikkekont, Farmpleb, Fizzx
Crispy Bacon, Mcsax, Synapsy, Aphrodítes, Rikezuge, Kage, Zugzugthorn, Trejwar, Myazaki, Kniv, Lethean, Abyssinthia
Lavish Suramar Feast, Lissy, Trejwar
