Salt and Pepper Shank, Ershil, Kharadras, Doublelift, Aphrodítes, Lylk, Solodem, Kage, Trejwar, Brudmar, Shagrath, Paimai, Kniv, Sagetotem, Ezeltjeprik, Uglizon, Emfargo
Deep-Fried Mossgill, Ershil, Kashra, Bovis, Kharadras, Doublelift, Aphrodítes, Lylk, Rikezuge, Solodem, Wâlda, Tuyna, Kage, Trejwar, Brudmar, Shagrath, Ariathorn, Paimai, Kniv, Lethean, Sagetotem, Boredsoon, Dikkekont, Aesthesia, Ambiguous, Uglizon, Emfargo
Pickled Stormray, Ershil, Kashra, Bop, Laesus, Bovis, Kharadras, Aphrodítes, Lylk, Nefele, Rikezuge, Solodem, Tuyna, Senll, Kage, Trejwar, Shagrath, Ariathorn, Paimai, Kniv, Lethean, Boredsoon, Dikkekont, Aesthesia, Ezeltjeprik, Uglizon, Emfargo
Faronaar Fizz, Ershil, Kashra, Bop, Laesus, Bovis, Kharadras, Doublelift, Aphrodítes, Nefele, Rikezuge, Solodem, Wâlda, Tuyna, Senll, Kage, Trejwar, Brudmar, Shagrath, Ariathorn, Paimai, Kniv, Lethean, Sagetotem, Boredsoon, Dikkekont, Aesthesia, Xplicite, Ezeltjeprik, Farmpleb, Ambiguous, Uglizon, Emfargo
Barracuda Mrglgagh, Ershil, Kharadras, Doublelift, Aphrodítes, Lylk, Solodem, Tuyna, Kage, Trejwar, Brudmar, Shagrath, Ariathorn, Paimai, Kniv, Sagetotem, Ezeltjeprik, Uglizon, Emfargo
Drogbar-Style Salmon, Ershil, Kashra, Aphrodítes, Lylk, Nefele, Rikezuge, Tuyna, Kage, Trejwar, Brudmar, Shagrath, Ariathorn, Paimai, Kniv, Lethean, Sagetotem, Aesthesia, Xplicite, Farmpleb, Emfargo
Bear Tartare, Ershil, Bop, Laesus, Aphrodítes, Lylk, Nefele, Rikezuge, Senll, Kage, Trejwar, Paimai, Kniv, Lethean, Boredsoon, Dikkekont, Xplicite, Ezeltjeprik, Farmpleb, Ambiguous, Emfargo
Fighter Chow, Ershil, Bop, Laesus, Bovis, Doublelift, Aphrodítes, Nefele, Rikezuge, Wâlda, Tuyna, Senll, Kage, Trejwar, Brudmar, Shagrath, Ariathorn, Paimai, Kniv, Lethean, Sagetotem, Boredsoon, Dikkekont, Aesthesia, Xplicite, Ezeltjeprik, Farmpleb, Uglizon
Dried Mackerel Strips, Ershil, Kashra, Bop, Laesus, Bovis, Kharadras, Aphrodítes, Lylk, Nefele, Rikezuge, Solodem, Wâlda, Tuyna, Senll, Kage, Trejwar, Brudmar, Shagrath, Ariathorn, Paimai, Kniv, Lethean, Sagetotem, Boredsoon, Dikkekont, Aesthesia, Xplicite, Ezeltjeprik, Farmpleb, Ambiguous, Uglizon, Emfargo
Spiced Wildfowl Omelet, Kashra, Aphrodítes, Kage, Trejwar, Kniv, Lethean
Leybeque Ribs, Bovis, Aphrodítes, Tuyna, Trejwar, Kniv, Boredsoon, Dikkekont, Farmpleb
Nightborne Delicacy Platter, Kharadras, Aphrodítes, Kage, Trejwar, Shagrath, Ariathorn, Paimai, Kniv, Lethean, Uglizon, Emfargo
Suramar Surf and Turf, Aphrodítes, Rikezuge, Tuyna, Trejwar, Kniv, Lethean
Azshari Salad, Aphrodítes, Rikezuge, Trejwar, Kniv, Lethean, Uglizon, Emfargo
Fishbrul Special, Aphrodítes, Rikezuge, Tuyna, Kage, Trejwar, Kniv
The Hungry Magister, Aphrodítes, Tuyna, Trejwar, Shagrath, Kniv, Lethean, Dikkekont, Uglizon, Emfargo
Crispy Bacon, Aphrodítes, Rikezuge, Kage, Trejwar, Kniv, Lethean
Spiced Rib Roast, Kage, Trejwar, Shagrath, Paimai, Boredsoon, Uglizon
Hearty Feast, Kage, Trejwar, Shagrath, Paimai, Uglizon
Seed-Battered Fish Plate, Trejwar, Kniv, Lethean
Lavish Suramar Feast, Trejwar
Koi-Scented Stormray, Trejwar
