Pickled Stormray, Fatali, Ershil, Kashra, Bop, Laesus, Mcsax, Malarky, Birche, Lissy, Bovis, Synapsy, Kharadras, Zinc, Caelastraz, Aphrodítes, Lylk, Nefele, Rikezuge, Tuyna, Rektharthorn, Senll, Kage, Trejwar, Amagaddon, Myazaki, Ridaar, Shagrath, Ariathorn, Paimai, Mtut, Kniv, Chaoslol, Moorder, Gribbz, Lethean, Boredsoon, Dikkekont, Aesthesia, Ezeltjeprik, Redcloak, Uglizon, Emfargo, Fizzx
Spiced Rib Roast, Fatali, Synapsy, Kage, Trejwar, Myazaki, Ridaar, Shagrath, Paimai, Mtut, Boredsoon, Uglizon
Azshari Salad, Fatali, Mcsax, Birche, Lissy, Synapsy, Rikezuge, Trejwar, Myazaki, Kniv, Lethean, Uglizon, Emfargo
Nightborne Delicacy Platter, Fatali, Mcsax, Malarky, Birche, Lissy, Kharadras, Caelastraz, Aphrodítes, Kage, Trejwar, Myazaki, Ridaar, Shagrath, Ariathorn, Paimai, Kniv, Lethean, Uglizon, Emfargo
Seed-Battered Fish Plate, Fatali, Malarky, Lissy, Trejwar, Myazaki, Kniv, Lethean
Fighter Chow, Fatali, Ershil, Bop, Laesus, Mcsax, Malarky, Birche, Lissy, Bovis, Synapsy, Zinc, Doublelift, Caelastraz, Aphrodítes, Nefele, Rikezuge, Wâlda, Tuyna, Rektharthorn, Senll, Kage, Trejwar, Brudmar, Amagaddon, Ridaar, Shagrath, Ariathorn, Paimai, Mtut, Kniv, Moorder, Gribbz, Lethean, Sagetotem, Boredsoon, Dikkekont, Aesthesia, Xplicite, Ezeltjeprik, Farmpleb, Redcloak, Uglizon, Smoothy, Revialea
Salt and Pepper Shank, Fatali, Ershil, Mcsax, Lissy, Synapsy, Kharadras, Doublelift, Caelastraz, Aphrodítes, Lylk, Rektharthorn, Kage, Trejwar, Brudmar, Amagaddon, Myazaki, Ridaar, Shagrath, Paimai, Mtut, Kniv, Sagetotem, Ezeltjeprik, Uglizon, Emfargo, Smoothy, Fizzx, Revialea
Faronaar Fizz, Fatali, Ershil, Kashra, Bop, Laesus, Mcsax, Malarky, Birche, Lissy, Bovis, Synapsy, Kharadras, Zinc, Doublelift, Caelastraz, Aphrodítes, Nefele, Rikezuge, Wâlda, Tuyna, Rektharthorn, Senll, Kage, Trejwar, Brudmar, Amagaddon, Ridaar, Shagrath, Ariathorn, Paimai, Mtut, Kniv, Chaoslol, Moorder, Gribbz, Lethean, Sagetotem, Boredsoon, Dikkekont, Aesthesia, Xplicite, Ezeltjeprik, Farmpleb, Redcloak, Ambiguous, Uglizon, Emfargo, Smoothy, Revialea
Suramar Surf and Turf, Fatali, Lissy, Rikezuge, Tuyna, Trejwar, Myazaki, Kniv, Lethean, Fizzx
Barracuda Mrglgagh, Fatali, Ershil, Mcsax, Lissy, Synapsy, Kharadras, Doublelift, Caelastraz, Aphrodítes, Lylk, Tuyna, Rektharthorn, Kage, Trejwar, Brudmar, Amagaddon, Myazaki, Ridaar, Shagrath, Ariathorn, Paimai, Mtut, Kniv, Sagetotem, Ezeltjeprik, Uglizon, Emfargo, Smoothy, Revialea
Koi-Scented Stormray, Fatali, Lissy, Trejwar
Drogbar-Style Salmon, Fatali, Ershil, Kashra, Mcsax, Malarky, Lissy, Synapsy, Zinc, Caelastraz, Aphrodítes, Lylk, Nefele, Rikezuge, Tuyna, Kage, Trejwar, Brudmar, Amagaddon, Shagrath, Ariathorn, Paimai, Mtut, Kniv, Chaoslol, Moorder, Gribbz, Lethean, Sagetotem, Aesthesia, Xplicite, Farmpleb, Emfargo, Smoothy, Fizzx, Revialea
Fishbrul Special, Fatali, Malarky, Lissy, Synapsy, Aphrodítes, Rikezuge, Tuyna, Kage, Trejwar, Kniv
Dried Mackerel Strips, Fatali, Ershil, Kashra, Bop, Laesus, Mcsax, Malarky, Birche, Lissy, Bovis, Synapsy, Kharadras, Zinc, Caelastraz, Aphrodítes, Lylk, Nefele, Rikezuge, Wâlda, Tuyna, Rektharthorn, Senll, Kage, Trejwar, Brudmar, Amagaddon, Myazaki, Ridaar, Shagrath, Ariathorn, Paimai, Mtut, Kniv, Chaoslol, Moorder, Gribbz, Lethean, Sagetotem, Boredsoon, Dikkekont, Aesthesia, Xplicite, Ezeltjeprik, Farmpleb, Redcloak, Ambiguous, Uglizon, Emfargo, Smoothy, Fizzx, Revialea
Bear Tartare, Fatali, Ershil, Bop, Laesus, Mcsax, Malarky, Birche, Lissy, Synapsy, Caelastraz, Aphrodítes, Lylk, Nefele, Rikezuge, Senll, Kage, Trejwar, Amagaddon, Myazaki, Ridaar, Paimai, Mtut, Kniv, Moorder, Lethean, Boredsoon, Dikkekont, Xplicite, Ezeltjeprik, Farmpleb, Redcloak, Ambiguous, Emfargo
Hearty Feast, Fatali, Synapsy, Kage, Trejwar, Ridaar, Shagrath, Paimai, Uglizon
Deep-Fried Mossgill, Fatali, Ershil, Kashra, Mcsax, Malarky, Birche, Lissy, Bovis, Synapsy, Kharadras, Zinc, Doublelift, Caelastraz, Aphrodítes, Lylk, Rikezuge, Wâlda, Tuyna, Kage, Trejwar, Brudmar, Amagaddon, Myazaki, Ridaar, Shagrath, Ariathorn, Paimai, Mtut, Kniv, Chaoslol, Gribbz, Lethean, Sagetotem, Boredsoon, Dikkekont, Aesthesia, Redcloak, Ambiguous, Uglizon, Emfargo, Fizzx, Revialea
Spiced Wildfowl Omelet, Fatali, Kashra, Lissy, Kage, Trejwar, Ridaar, Kniv, Lethean
The Hungry Magister, Mcsax, Malarky, Lissy, Aphrodítes, Tuyna, Trejwar, Myazaki, Ridaar, Shagrath, Kniv, Lethean, Dikkekont, Uglizon, Emfargo
Leybeque Ribs, Mcsax, Lissy, Bovis, Aphrodítes, Tuyna, Trejwar, Myazaki, Ridaar, Kniv, Boredsoon, Dikkekont, Farmpleb, Fizzx
Crispy Bacon, Mcsax, Synapsy, Aphrodítes, Rikezuge, Kage, Trejwar, Myazaki, Kniv, Lethean
Lavish Suramar Feast, Lissy, Trejwar
