Deep-Fried Mossgill, Kokushu, Ershil, Grûnna, Mcsax, Vodash, Birche, Lissy, Bovis, Synapsy, Aphrodítes, Rikezuge, Tuyna, Kage, Zugzugthorn, Trejwar, Brudmar, Amagaddon, Myazaki, Kokushi, Ridaar, Shagrath, Ariathorn, Féipìgu, Paimai, Mtut, Kniv, Epie, Flammewild, Gribbz, Lethean, Abyssinthia, Boredsoon, Dikkekont, Aesthesia
Pickled Stormray, Kokushu, Ershil, Grûnna, Mcsax, Vodash, Birche, Lissy, Bovis, Synapsy, Aphrodítes, Rikezuge, Tuyna, Kage, Zugzugthorn, Trejwar, Amagaddon, Myazaki, Kokushi, Ridaar, Ariathorn, Féipìgu, Paimai, Mtut, Kniv, Epie, Flammewild, Lethean, Abyssinthia, Boredsoon, Dikkekont, Aesthesia, Ezeltjeprik
Faronaar Fizz, Kokushu, Ershil, Grûnna, Mcsax, Vodash, Birche, Lissy, Bovis, Synapsy, Aphrodítes, Rikezuge, Tuyna, Kage, Zugzugthorn, Trejwar, Brudmar, Amagaddon, Kokushi, Ridaar, Shagrath, Ariathorn, Féipìgu, Paimai, Mtut, Kniv, Epie, Flammewild, Lethean, Abyssinthia, Boredsoon, Dikkekont, Aesthesia, Ezeltjeprik, Farmpleb
Leybeque Ribs, Kokushu, Vodash, Aphrodítes, Tuyna, Trejwar, Myazaki, Ridaar, Féipìgu, Kniv, Epie, Abyssinthia, Boredsoon, Dikkekont
Fighter Chow, Kokushu, Ershil, Grûnna, Mcsax, Vodash, Birche, Bovis, Synapsy, Aphrodítes, Rikezuge, Tuyna, Kage, Zugzugthorn, Trejwar, Brudmar, Amagaddon, Kokushi, Ridaar, Shagrath, Ariathorn, Féipìgu, Paimai, Mtut, Kniv, Epie, Flammewild, Lethean, Abyssinthia, Boredsoon, Dikkekont, Aesthesia, Ezeltjeprik, Farmpleb
Dried Mackerel Strips, Kokushu, Ershil, Grûnna, Mcsax, Vodash, Birche, Lissy, Bovis, Synapsy, Aphrodítes, Rikezuge, Tuyna, Kage, Zugzugthorn, Trejwar, Amagaddon, Myazaki, Kokushi, Ridaar, Shagrath, Ariathorn, Féipìgu, Paimai, Mtut, Kniv, Epie, Flammewild, Gribbz, Lethean, Abyssinthia, Boredsoon, Dikkekont, Aesthesia, Ezeltjeprik, Farmpleb
Salt and Pepper Shank, Ershil, Grûnna, Mcsax, Vodash, Lissy, Synapsy, Aphrodítes, Kage, Zugzugthorn, Trejwar, Brudmar, Amagaddon, Myazaki, Ridaar, Shagrath, Féipìgu, Paimai, Mtut, Kniv, Flammewild, Ezeltjeprik
Barracuda Mrglgagh, Ershil, Grûnna, Mcsax, Vodash, Lissy, Synapsy, Aphrodítes, Kage, Zugzugthorn, Trejwar, Brudmar, Amagaddon, Myazaki, Ridaar, Shagrath, Ariathorn, Féipìgu, Paimai, Mtut, Kniv, Flammewild, Ezeltjeprik
Drogbar-Style Salmon, Ershil, Grûnna, Mcsax, Vodash, Lissy, Synapsy, Aphrodítes, Rikezuge, Tuyna, Kage, Zugzugthorn, Trejwar, Brudmar, Amagaddon, Kokushi, Shagrath, Féipìgu, Paimai, Mtut, Kniv, Flammewild, Lethean, Abyssinthia, Aesthesia, Farmpleb
Bear Tartare, Ershil, Mcsax, Birche, Synapsy, Aphrodítes, Rikezuge, Kage, Zugzugthorn, Trejwar, Amagaddon, Myazaki, Kokushi, Ridaar, Féipìgu, Paimai, Mtut, Kniv, Epie, Lethean, Abyssinthia, Boredsoon, Dikkekont, Ezeltjeprik, Farmpleb
Nightborne Delicacy Platter, Grûnna, Kage, Zugzugthorn, Trejwar, Myazaki, Shagrath, Féipìgu, Paimai, Flammewild
Spiced Rib Roast, Grûnna, Kage, Trejwar, Myazaki, Kokushi, Ridaar, Shagrath, Paimai, Mtut, Boredsoon
Fishbrul Special, Grûnna, Synapsy, Rikezuge, Kage, Zugzugthorn, Kniv, Abyssinthia
Hearty Feast, Grûnna, Kage, Trejwar, Ridaar, Paimai
Suramar Surf and Turf, Vodash, Rikezuge, Tuyna, Trejwar, Myazaki, Kniv, Flammewild, Lethean, Abyssinthia
Azshari Salad, Vodash, Rikezuge, Trejwar, Myazaki, Abyssinthia
Crispy Bacon, Synapsy, Aphrodítes, Rikezuge, Kage, Zugzugthorn, Trejwar, Myazaki, Kokushi, Kniv, Epie, Lethean, Abyssinthia
The Hungry Magister, Aphrodítes, Trejwar, Myazaki, Ridaar, Féipìgu, Kniv, Epie, Abyssinthia, Dikkekont
Koi-Scented Stormray, Trejwar
Lavish Suramar Feast, Trejwar
